{
  "generated_at": "2025-11-11T13:22:27.245570+00:00",
  "folder": "sandbox/windows/release",
  "report_path": "sandbox/windows/release/report.txt",
  "commits": [
    {
      "kind": "head",
      "id": "head:master:d64e1305c566fd03cb860745b108de610bd85c54",
      "git_sha": "d64e1305c566fd03cb860745b108de610bd85c54",
      "git_message": "Merge branch 'master' of https://github.com/d954mas/neotolis-game-engine",
      "branch": "master",
      "subject": "Merge branch 'master' of https://github.com/d954mas/neotolis-game-engine",
      "date": "2025-11-11T13:22:27.245570+00:00",
      "label": "HEAD-master-Merge branch 'master' of https://github.com/d954mas/neotolis-game-engine-d64e130",
      "artifacts": [
        {
          "file_name": "engine.exe",
          "size_bytes": 10240
        }
      ]
    },
    {
      "kind": "branch",
      "id": "branch:master:08cf815bfec3c5eac68f696f6dd777d504f6f8ea",
      "git_sha": "08cf815bfec3c5eac68f696f6dd777d504f6f8ea",
      "git_message": "build wasm on windows",
      "branch": "master",
      "subject": "build wasm on windows",
      "date": "2025-11-05T19:08:35+05:00",
      "label": "master-build wasm on windows-08cf815",
      "artifacts": [
        {
          "file_name": "engine.exe",
          "size_bytes": 9728
        }
      ]
    },
    {
      "kind": "branch",
      "id": "branch:003-add-size-reports:3876a4cccdd02a2b4d7a3952de7cc4e37396f960",
      "git_sha": "3876a4cccdd02a2b4d7a3952de7cc4e37396f960",
      "git_message": "fixed branch history",
      "branch": "003-add-size-reports",
      "subject": "fixed branch history",
      "date": "2025-11-05T17:32:42+05:00",
      "label": "003-add-size-reports-fixed branch history-3876a4c",
      "artifacts": [
        {
          "file_name": "engine.exe",
          "size_bytes": 9728
        }
      ]
    }
  ]
}