{
  "generated_at": "2025-11-07T11:15:23.660863+00:00",
  "folder": "sandbox/wasm/debug",
  "report_path": "sandbox/wasm/debug/report.txt",
  "commits": [
    {
      "kind": "head",
      "id": "head:005-publish-web-report:2877ef53c7d08f5b5d6b401723a7b69ceb2c25a3",
      "git_sha": "2877ef53c7d08f5b5d6b401723a7b69ceb2c25a3",
      "git_message": "web page",
      "branch": "005-publish-web-report",
      "subject": "web page",
      "date": "2025-11-07T11:15:23.660863+00:00",
      "label": "HEAD-005-publish-web-report-web page-2877ef5",
      "artifacts": [
        {
          "file_name": "index.html",
          "size_bytes": 22270
        },
        {
          "file_name": "nt_sandbox.js",
          "size_bytes": 50372
        },
        {
          "file_name": "nt_sandbox.wasm",
          "size_bytes": 1206556
        },
        {
          "file_name": "nt_sandbox.wasm.map",
          "size_bytes": 87675
        }
      ]
    },
    {
      "kind": "branch",
      "id": "branch:003-add-size-reports:3876a4cccdd02a2b4d7a3952de7cc4e37396f960",
      "git_sha": "3876a4cccdd02a2b4d7a3952de7cc4e37396f960",
      "git_message": "fixed branch history",
      "branch": "003-add-size-reports",
      "subject": "fixed branch history",
      "date": "2025-11-05T17:32:42+05:00",
      "label": "003-add-size-reports-fixed branch history-3876a4c",
      "artifacts": [
        {
          "file_name": "index.html",
          "size_bytes": 22190
        },
        {
          "file_name": "nt_sandbox.js",
          "size_bytes": 65533
        },
        {
          "file_name": "nt_sandbox.wasm",
          "size_bytes": 1200419
        },
        {
          "file_name": "nt_sandbox.wasm.map",
          "size_bytes": 90100
        }
      ]
    }
  ]
}