{
  "generated_at": "2025-11-05T13:48:19.303216+00:00",
  "folder": "sandbox/windows/debug",
  "report_path": "sandbox/windows/debug/report.txt",
  "commits": [
    {
      "kind": "head",
      "id": "head:master:e318eecd8c37be5effa2046d07b2ea55c95daa73",
      "git_sha": "e318eecd8c37be5effa2046d07b2ea55c95daa73",
      "git_message": "sandbox size report",
      "branch": "master",
      "subject": "sandbox size report",
      "date": "2025-11-05T13:51:06.161624+00:00",
      "label": "HEAD-master-sandbox size report-e318eec",
      "artifacts": [
        {
          "file_name": "cmake_install.cmake",
          "size_bytes": 1378
        },
        {
          "file_name": "nt_sandbox.exe",
          "size_bytes": 19968
        },
        {
          "file_name": "nt_sandbox.pdb",
          "size_bytes": 495616
        }
      ]
    },
    {
      "kind": "branch",
      "id": "branch:master:e71f3732466622f12342bc3fcbf8f48d3dcec6a5",
      "git_sha": "e71f3732466622f12342bc3fcbf8f48d3dcec6a5",
      "git_message": "chore: update sandbox size reports",
      "branch": "master",
      "subject": "chore: update sandbox size reports",
      "date": "2025-11-05T13:37:47Z",
      "label": "master-chore: update sandbox size reports-e71f373",
      "artifacts": [
        {
          "file_name": "engine.exe",
          "size_bytes": 19968
        }
      ]
    },
    {
      "kind": "branch",
      "id": "branch:003-add-size-reports:3876a4cccdd02a2b4d7a3952de7cc4e37396f960",
      "git_sha": "3876a4cccdd02a2b4d7a3952de7cc4e37396f960",
      "git_message": "fixed branch history",
      "branch": "003-add-size-reports",
      "subject": "fixed branch history",
      "date": "2025-11-05T17:32:42+05:00",
      "label": "003-add-size-reports-fixed branch history-3876a4c",
      "artifacts": [
        {
          "file_name": "engine.exe",
          "size_bytes": 19968
        }
      ]
    }
  ]
}